{
  "$schema": "https://json-schema.org/draft/2020-12/schema",
  "$id": "https://example.local/rag/apm/package.manifest.schema.json",
  "title": "RAG MCP APM Package Manifest",
  "type": "object",
  "additionalProperties": false,
  "required": [
    "package",
    "runtime",
    "compatibility",
    "tools",
    "environment",
    "operational"
  ],
  "properties": {
    "package": {
      "type": "object",
      "additionalProperties": false,
      "required": ["name", "version", "owner", "status"],
      "properties": {
        "name": { "type": "string", "minLength": 1 },
        "displayName": { "type": "string" },
        "version": { "type": "string", "pattern": "^[0-9]+\\.[0-9]+\\.[0-9]+(-[a-zA-Z0-9.-]+)?$" },
        "owner": { "type": "string", "minLength": 1 },
        "description": { "type": "string" },
        "status": { "type": "string", "enum": ["draft", "validated", "approved", "deprecated"] }
      }
    },
    "runtime": {
      "type": "object",
      "additionalProperties": false,
      "required": ["transport", "entrypoint", "framework", "mcpSdk"],
      "properties": {
        "transport": { "type": "string", "enum": ["stdio", "http"] },
        "entrypoint": { "type": "string", "minLength": 1 },
        "framework": { "type": "string", "minLength": 1 },
        "mcpSdk": { "type": "string", "minLength": 1 }
      }
    },
    "compatibility": {
      "type": "object",
      "additionalProperties": false,
      "required": ["mcpProtocol", "breakingChangePolicy"],
      "properties": {
        "mcpProtocol": { "type": "string", "minLength": 1 },
        "breakingChangePolicy": { "type": "string", "minLength": 1 }
      }
    },
    "tools": {
      "type": "array",
      "minItems": 1,
      "items": {
        "type": "object",
        "additionalProperties": false,
        "required": ["name", "status", "inputSchema"],
        "properties": {
          "name": { "type": "string", "minLength": 1 },
          "status": { "type": "string", "enum": ["active", "planned", "deprecated"] },
          "description": { "type": "string" },
          "inputSchema": { "type": "object" }
        }
      }
    },
    "environment": {
      "type": "object",
      "additionalProperties": false,
      "required": ["required", "optional"],
      "properties": {
        "required": { "type": "array", "items": { "type": "string" } },
        "optional": { "type": "array", "items": { "type": "string" } }
      }
    },
    "operational": {
      "type": "object",
      "additionalProperties": false,
      "required": ["requestTimeoutSeconds", "retryPolicy", "observability"],
      "properties": {
        "requestTimeoutSeconds": { "type": "integer", "minimum": 1 },
        "retryPolicy": { "type": "string", "minLength": 1 },
        "observability": {
          "type": "object",
          "additionalProperties": true
        }
      }
    }
  }
}